{"schema_version":1,"workspace_id":"ws_alpha","scope":{"kind":"project","project_id":"proj"},"delivery_id":"delivery_one","message_id":"msg_one","attempt_id":"attempt_one","endpoint_id":"endpoint_one","session_ref_id":"session_one","outcome":"accepted","evidence":{"schema_version":1,"workspace_id":"ws_alpha","scope":{"kind":"project","project_id":"proj"},"evidence_id":"evidence_delivery","evidence_kind":"native_delivery_state","quality":"authoritative","state":"accepted","authority":{"authority_kind":"native_runtime","identity":"native_adapter","implementation_revision":"r1","capability_profile_id":"native_delivery","capability_profile_revision":"r1"},"subject":{"message_id":"msg_one","delivery_id":"delivery_one","attempt_id":"attempt_one","endpoint_id":"endpoint_one","session_ref_id":"session_one"},"correlation_id":"attempt_one","observed_at_utc":"2026-07-19T00:00:00Z","integrity":"sha256:42ce6476223b983281365dad8a5eebd1926c92e9a61e89b8dd97de861f4bbbd1"}}
